{
  "formTitle": "Job Application Form",
  "formDescription": "Please complete all sections of this application form accurately.",
  "submitButtonText": "Submit Application",
  "layout": {
    "columnCount": 1,
    "cssClass": "job-application-form",
    "layoutOptions": [
      {
        "type": "stepper",
        "steps": [
          {
            "id": "basicInfo",
            "title": "Basic Information",
            "description": "Provide your personal details",
            "order": 1,
            "sectionId": ["personalInfo"]
          }
        ]
      },
      {
        "type": "list",
        "steps": [
          {
            "id": "step1",
            "title": "Basic Information",
            "description": "Provide your personal details",
            "sectionId": ["personalInfo"],
            "order": 1
          }
        ]
      }
    ]
  },
  "sections": [
    {
      "id": "personalInfo",
      "title": "Personal Information",
      "description": "Please provide your personal details",
      "order": 1,
      "layout": {
        "columnCount": 2,
        "cssClass": "personal-info-section",
        "collapsible": true,
        "defaultCollapsed": false
      },
      "visibility": "true",
      "editability": "",
      "conditionalDisplay": "",
      "fields": [
        {
          "id": "vacationPeriod",
          "name": "vacationPeriod",
          "label": "Vacation Period",
          "type": "DATE_RANGE_PICKER",
          "defaultValue": "",
          "description": "Select your vacation start and end dates",
          "hidden": false,
          "disabled": false,
          "readOnlyDisplay": "text",
          "placeholder": "Select date range",
          "startRange": "1900-01-01",
          "endRange": "2026-09-23",
          "dateFormat": "yyyy-MM-dd",
          "layout": {
            "columnCount": 2,
            "labelPosition": "top"
          },
          "helperText": "Vacation period must be between 1 and 30 days",
          "cssClass": "vacation-date-range",
          "validations": [
            {
              "type": "required",
              "value": "true",
              "message": "Please select both start and end dates"
            },
            {
              "type": "minDate",
              "value": "2000-01-15",
              "message": "Vacation cannot start before January 15, 2024"
            },
            {
              "type": "maxDate",
              "value": "2024-12-31",
              "message": "Vacation must start before December 31, 2024"
            }
          ],
          "visibility": "true",
          "editability": "",
          "conditionalDisplay": ""
        }
      ]
    }
  ]
}
