{
  "formTitle": "Job Application Form",
  "formDescription": "Please complete all sections of this application form accurately.",
  "submitButtonText": "Submit Application",
  "layout": {
    "columnCount": 1,
    "cssClass": "job-application-form",
    "layoutOptions": [
      {
        "type": "stepper",
        "steps": [
          {
            "id": "basicInfo",
            "title": "Basic Information",
            "description": "Provide your personal details",
            "order": 1,
            "sectionId": ["personalInfo"]
          }
        ]
      },
      {
        "type": "list",
        "steps": [
          {
            "id": "step1",
            "title": "Basic Information",
            "description": "Provide your personal details",
            "sectionId": ["personalInfo"],
            "order": 1
          }
        ]
      }
    ]
  },
  "sections": [
    {
      "id": "personalInfo",
      "title": "Personal Information",
      "description": "Please provide your personal details",
      "order": 1,
      "layout": {
        "columnCount": 2,
        "cssClass": "personal-info-section",
        "collapsible": true,
        "defaultCollapsed": false
      },
      "visibility": "true",
      "editability": "",
      "conditionalDisplay": "",
      "fields": [
        {
          "id": "personFirstName",
          "name": "personFirstName",
          "label": "Full Name",
          "type": "TEXT",
          "defaultValue": "",
          "description": "Enter your First legal name as shown on government ID",
          "hidden": false,
          "disabled": false,
          "placeholder": "e.g., John Doe",
          "formatter": "(XXX) XXX-XXXX",
          "readOnlyDisplay": "text",
          "helperText": "Your name will appear on all official documents",
          "cssClass": "full-width",

          "validations": [
            {
              "type": "required",
              "value": "true",
              "message": "Name is required"
            },
            {
              "type": "minLength",
              "value": "2",
              "message": "Name must be at least 2 characters long"
            },
            {
              "type": "maxLength",
              "value": "100",
              "message": "Name must be under 100 characters"
            },
            {
              "type": "pattern",
              "value": "^[A-Za-z ]+$",
              "message": "Name can only contain letters and spaces"
            },
            {
              "type": "customValidator",
              "value": "",
              "message": ""
            }
          ],
          "visibility": "true",
          "editability": "",
          "conditionalDisplay": ""
        }
      ]
    }
  ]
}
