{
  "formTitle": "Job Application Form",
  "formDescription": "Please complete all sections of this application form accurately.",
  "submitButtonText": "Submit Application",
  "layout": {
    "columnCount": 1,
    "cssClass": "job-application-form",
    "layoutOptions": [
      {
        "type": "stepper",
        "steps": [
          {
            "id": "basicInfo",
            "title": "Basic Information",
            "description": "Provide your personal details",
            "order": 1,
            "sectionId": [
              "personalInfo"
            ]
          }
        ]
      },
      {
        "type": "list",
        "steps": [
          {
            "id": "step1",
            "title": "Basic Information",
            "description": "Provide your personal details",
            "sectionId": [
              "personalInfo"
            ],
            "order": 1
          }
        ]
      }
    ]
  },
  "sections": [
    {
      "id": "personalInfo",
      "title": "Personal Information",
      "description": "Please provide your personal details",
      "order": 1,
      "layout": {
        "columnCount": 2,
        "cssClass": "personal-info-section",
        "collapsible": true,
        "defaultCollapsed": false
      },
      "visibility": "true",
      "editability": "",
      "conditionalDisplay": "",
      "fields": [
        {
          "id": "personSurName",
          "name": "personSurName",
          "label": "Sur Name",
          "type": "TEXT",
          "defaultValue": "",
          "description": "Enter your surname as shown on government ID",
          "hidden": false,
          "disabled": false,
          "placeholder": "e.g., John Doe",
          "formatter": "(XXX) XXX-XXXX",
          "readOnlyDisplay": "text",
          "helperText": "Your name will appear on all official documents",
          "cssClass": "full-width",
          "validations": [],
          "visibility": "true",
          "editability": "",
          "conditionalDisplay": ""
        },
        {
          "id": "contactEmail",
          "name": "contactEmail",
          "label": "Contact Email",
          "type": "EMAIL",
          "defaultValue": "",
          "description": "Enter your business email address",
          "hidden": false,
          "disabled": false,
          "readOnlyDisplay": "text",
          "placeholder": "john.doe@company.com",
          "layout": {
            "columnCount": 1,
            "labelPosition": "top"
          },
          "helperText": "We will send important notifications to this email address",
          "cssClass": "contact-email-field",
          "validations": [],
          "visibility": "true",
          "editability": "",
          "conditionalDisplay": ""
        },
        {
          "id": "fromDate",
          "name": "birthDate",
          "label": "Date of Birth",
          "type": "DATE",
          "defaultValue": "",
          "description": "Please enter your date of birth",
          "hidden": false,
          "dateFormat": "YYYY-MM-DD",
          "min": "",
          "max": "",
          "disabled": false,
          "readOnlyDisplay": "text",
          "placeholder": "MM/DD/YYYY",
          "layout": {
            "columnCount": 1,
            "labelPosition": "top"
          },
          "helperText": "You must be at least 18 years old to register",
          "cssClass": "birth-date-field",
          "validations": [],
          "visibility": "true",
          "editability": "",
          "conditionalDisplay": ""
        },
        {
          "id": "toDate",
          "name": "birthDate",
          "label": "Date of Birth",
          "type": "DATE",
          "defaultValue": "",
          "description": "Please enter your date of birth",
          "hidden": false,
          "dateFormat": "YYYY-MM-DD",
          "min": "",
          "max": "",
          "disabled": false,
          "readOnlyDisplay": "text",
          "placeholder": "MM/DD/YYYY",
          "layout": {
            "columnCount": 1,
            "labelPosition": "top"
          },
          "helperText": "You must be at least 18 years old to register",
          "cssClass": "birth-date-field",
          "validations": [],
          "visibility": "true",
          "editability": "",
          "conditionalDisplay": "(fromDate > '2002-01-01' && fromDate  < '2024-04-18')"
        }
      ]
    }
  ]
}
