{
  "formTitle": "Job Application Form",
  "formDescription": "Please complete all sections of this application form accurately.",
  "submitButtonText": "Submit Application",
  "layout": {
    "columnCount": 1,
    "cssClass": "job-application-form",
    "layoutOptions": [
      {
        "type": "stepper",
        "steps": [
          {
            "id": "basicInfo",
            "title": "Basic Information",
            "description": "Provide your personal details",
            "order": 1,
            "sectionId": [
              "personalInfo"
            ]
          }
        ]
      },
      {
        "type": "list",
        "steps": [
          {
            "id": "step1",
            "title": "Basic Information",
            "description": "Provide your personal details",
            "sectionId": [
              "personalInfo"
            ],
            "order": 1
          }
        ]
      }
    ]
  },
  "sections": [
    {
      "id": "personalInfo",
      "title": "Personal Information",
      "description": "Please provide your personal details",
      "order": 1,
      "layout": {
        "columnCount": 2,
        "cssClass": "personal-info-section",
        "collapsible": true,
        "defaultCollapsed": false
      },
      "visibility": "true",
      "editability": "",
      "conditionalDisplay": "",
      "fields": [
        {
          "id": "fromDate",
          "name": "birthDate",
          "label": "Date of Birth",
          "type": "DATE",
          "defaultValue": "",
          "description": "Please enter your date of birth",
          "hidden": false,
          "dateFormat": "YYYY-MM-DD",
          "min": "",
          "max": "",
          "disabled": false,
          "readOnlyDisplay": "text",
          "placeholder": "MM/DD/YYYY",
          "layout": {
            "columnCount": 1,
            "labelPosition": "top"
          },
          "helperText": "You must be at least 18 years old to register",
          "cssClass": "birth-date-field",
          "validations": [],
          "visibility": "true",
          "editability": "",
          "conditionalDisplay": ""
        },
        {
          "id": "vacationPeriod",
          "name": "vacationPeriod",
          "label": "Vacation Period",
          "type": "DATE_RANGE_PICKER",
          "defaultValue": "",
          "description": "Select your vacation start and end dates",
          "hidden": false,
          "disabled": false,
          "readOnlyDisplay": "text",
          "placeholder": "Select date range",
          "startRange": "1900-01-01",
          "endRange": "2025-09-23",
          "dateFormat": "yyyy-MM-dd",
          "layout": {
            "columnCount": 2,
            "labelPosition": "top"
          },
          "helperText": "Vacation period must be between 1 and 30 days",
          "cssClass": "vacation-date-range",
          "validations": [],
          "visibility": "true",
          "editability": "(fromDate !== null && fromDate !== '')",
          "conditionalDisplay": ""
        }
      ]
    }
  ]
}
