{
  "formTitle": "Job Application Form",
  "formDescription": "Please complete all sections of this application form accurately.",
  "submitButtonText": "Submit Application",
  "layout": {
    "columnCount": 1,
    "cssClass": "job-application-form",
    "layoutOptions": [
      {
        "type": "stepper",
        "steps": [
          {
            "id": "basicInfo",
            "title": "Basic Information",
            "description": "Provide your personal details",
            "order": 1,
            "sectionId": ["personalInfo"]
          }
        ]
      },
      {
        "type": "list",
        "steps": [
          {
            "id": "step1",
            "title": "Basic Information",
            "description": "Provide your personal details",
            "sectionId": ["personalInfo"],
            "order": 1
          }
        ]
      }
    ]
  },
  "sections": [
    {
      "id": "personalInfo",
      "title": "Personal Information",
      "description": "Please provide your personal details",
      "order": 1,
      "layout": {
        "columnCount": 2,
        "cssClass": "personal-info-section",
        "collapsible": true,
        "defaultCollapsed": false
      },
      "visibility": "true",
      "editability": "",
      "conditionalDisplay": "",
      "fields": [
        {
          "id": "phoneNumber",
          "name": "phoneNumber",
          "label": "Phone Number",
          "type": "PHONE",
          "defaultValue": "",
          "description": "Please enter your primary contact number",
          "hidden": false,
          "disabled": false,
          "placeholder": "Enter phone number (e.g., +1 555-555-5555)",
          "readOnlyDisplay": "text",
          "helperText": "Include country code and area code",
          "cssClass": "phone-input",
          "layout": {
            "columnCount": 1,
            "labelPosition": "top"
          },
          "validations": [
            {
              "type": "required",
              "value": "true",
              "message": "Phone number is required"
            },
            {
              "type": "minLength",
              "value": "10",
              "message": "Phone number must be at least 10 digits"
            },
            {
              "type": "maxLength",
              "value": "15",
              "message": "Phone number cannot exceed 15 digits"
            },
            {
              "type": "pattern",
              "value": "^\\+?[1-9]\\d{1,14}$",
              "message": "Please enter a valid phone number"
            },
            {
              "type": "phone",
              "value": "true",
              "message": "Please enter a valid international phone number"
            },
            {
              "type": "customValidator",
              "value": "",
              "message": ""
            }
          ],
          "visibility": "true",
          "editability": "",
          "conditionalDisplay": ""
        }
      ]
    }
  ]
}
