{
  "formTitle": "Job Application Form",
  "formDescription": "Please complete all sections of this application form accurately.",
  "submitButtonText": "Submit Application",
  "layout": {
    "columnCount": 1,
    "cssClass": "job-application-form",
    "layoutOptions": [
      {
        "type": "stepper",
        "steps": [
          {
            "id": "basicInfo",
            "title": "Basic Information",
            "description": "Provide your personal details",
            "order": 1,
            "sectionId": ["personalInfo"]
          }
        ]
      },
      {
        "type": "list",
        "steps": [
          {
            "id": "step1",
            "title": "Basic Information",
            "description": "Provide your personal details",
            "sectionId": ["personalInfo"],
            "order": 1
          }
        ]
      }
    ]
  },
  "sections": [
    {
      "id": "personalInfo",
      "title": "Personal Information",
      "description": "Please provide your personal details",
      "order": 1,
      "layout": {
        "columnCount": 2,
        "cssClass": "personal-info-section",
        "collapsible": true,
        "defaultCollapsed": false
      },
      "visibility": "true",
      "editability": "",
      "conditionalDisplay": "",
      "fields": [
        {
          "id": "appointmentTime",
          "name": "appointmentTime",
          "label": "Preferred Time",
          "type": "TIME",
          "defaultValue": "09:00",
          "description": "Select your preferred appointment time",
          "hidden": false,
          "timeFormat": "HH:mm",
          "min": "",
          "max": "",
          "disabled": false,
          "readOnlyDisplay": "text",
          "placeholder": "HH:mm",
          "layout": {
            "columnCount": 1,
            "labelPosition": "top"
          },
          "helperText": "Business hours are from 09:00 to 17:00",
          "cssClass": "appointment-time-field",
          "validations": [
            {
              "type": "required",
              "value": "true",
              "message": "Please select an appointment time"
            },
            {
              "type": "minTime",
              "value": "09:00",
              "message": "Appointments start from 09:00"
            },
            {
              "type": "maxTime",
              "value": "17:00",
              "message": "Last appointment must be before 17:00"
            },
            {
              "type": "customValidator",
              "value": "",
              "message": ""
            }
          ],
          "visibility": "true",
          "editability": "",
          "conditionalDisplay": ""
        }
      ]
    }
  ]
}
