{
  "formTitle": "Job Application Form",
  "formDescription": "Please complete all sections of this application form accurately.",
  "submitButtonText": "Submit Application",
  "layout": {
    "columnCount": 1,
    "cssClass": "job-application-form",
    "layoutOptions": [
      {
        "type": "stepper",
        "steps": [
          {
            "id": "basicInfo",
            "title": "Basic Information",
            "description": "Provide your personal details",
            "order": 1,
            "sectionId": [
              "personalInfo"
            ]
          }
        ]
      },
      {
        "type": "list",
        "steps": [
          {
            "id": "step1",
            "title": "Basic Information",
            "description": "Provide your personal details",
            "sectionId": [
              "personalInfo"
            ],
            "order": 1
          }
        ]
      }
    ]
  },
  "sections": [
    {
      "id": "personalInfo",
      "title": "Personal Information",
      "description": "Please provide your personal details",
      "order": 1,
      "layout": {
        "columnCount": 2,
        "cssClass": "personal-info-section",
        "collapsible": true,
        "defaultCollapsed": false
      },
      "visibility": "true",
      "editability": "",
      "conditionalDisplay": "",
      "fields": [
        {
          "id": "expectedSalary",
          "name": "expectedSalary",
          "label": "Expected Salary (Monthly)",
          "type": "CURRENCY",
          "defaultValue": "",
          "description": "Specify your monthly expected salary in your preferred currency",
          "hidden": false,
          "disabled": false,
          "placeholder": "e.g., 50000",
          "readOnlyDisplay": "text",
          "readOnlyTemplate": "text",
          "helperText": "Please provide your expected salary per month",
          "cssClass": "half-width salary-field",
          "layout": {
            "columnCount": 1,
            "labelPosition": "top"
          },
          "validations": [
            {
              "type": "required",
              "value": "true",
              "message": "Salary is required"
            },
            {
              "type": "minValue",
              "value": "1000",
              "message": "Salary must be at least ₹1000"
            },
            {
              "type": "maxValue",
              "value": "1000000",
              "message": "Salary should not exceed ₹10,00,000"
            },
            {
              "type": "pattern",
              "value": "^\\d{1,7}.\\d{2}$",
              "message": "Expected salary must be in proper format"
            }
          ],
          "visibility": "true",
          "editability": "",
          "conditionalDisplay": ""
        }
      ]
    }
  ]
}
