{
  "formTitle": "Job Application Form",
  "formDescription": "Please complete all sections of this application form accurately.",
  "submitButtonText": "Submit Application",
  "layout": {
    "columnCount": 1,
    "cssClass": "job-application-form",
    "layoutOptions": [
      {
        "type": "stepper",
        "steps": [
          {
            "id": "basicInfo",
            "title": "Basic Information",
            "description": "Provide your personal details",
            "order": 1,
            "sectionId": ["personalInfo"]
          }
        ]
      },
      {
        "type": "list",
        "steps": [
          {
            "id": "step1",
            "title": "Basic Information",
            "description": "Provide your personal details",
            "sectionId": ["personalInfo"],
            "order": 1
          }
        ]
      }
    ]
  },
  "sections": [
    {
      "id": "personalInfo",
      "title": "Personal Information",
      "description": "Please provide your personal details",
      "order": 1,
      "layout": {
        "columnCount": 2,
        "cssClass": "personal-info-section",
        "collapsible": true,
        "defaultCollapsed": false
      },
      "visibility": "true",
      "editability": "",
      "conditionalDisplay": "",
      "fields": [
        {
          "id": "appointmentDateTime",
          "name": "appointmentDateTime",
          "label": "Appointment Date & Time",
          "type": "DATETIME",
          "defaultValue": "",
          "description": "Select your preferred appointment date and time",
          "hidden": false,
          "disabled": false,
          "readOnlyDisplay": "text",
          "placeholder": "YYYY-MM-DD HH:mm",
          "dateTimeFormat": "yyyy-MM-dd HH:mm",
          "layout": {
            "columnCount": 1,
            "labelPosition": "top"
          },
          "helperText": "Appointments available Monday-Friday, 9 AM to 5 PM",
          "cssClass": "appointment-datetime-field",
          "validations": [
            {
              "type": "required",
              "value": "true",
              "message": "Appointment date and time is required"
            },
            {
              "type": "minDate",
              "value": "2024-01-15",
              "message": "Appointments must be scheduled at least 24 hours in advance"
            },
            {
              "type": "maxDate",
              "value": "2024-12-31",
              "message": "Appointments cannot be scheduled more than 1 year in advance"
            },
            {
              "type": "minTime",
              "value": "09:00",
              "message": "Appointments start from 9:00 AM"
            },
            {
              "type": "maxTime",
              "value": "17:00",
              "message": "Last appointment must be before 5:00 PM"
            },
            {
              "type": "customValidator",
              "value": "",
              "message": ""
            }
          ],
          "visibility": "true",
          "editability": "",
          "conditionalDisplay": ""
        }
      ]
    }
  ]
}
